Date,Category,Payment_Mode,Description,Amount_Paid,Cashback
12/17/2024,Entertainment,Cash,At approach officer vote case anyone.,465.74,17.05
6/16/2024,Subscriptions,UPI,Floor man common.,36.17,0
10/7/2024,Groceries,NetBanking,Left job toward study increase.,162.63,17.23
3/28/2024,Food,Cash,Forget and base must raise.,387.68,0
11/13/2024,Transportation,UPI,Fire network thousand happen.,239.11,9.62
9/28/2024,Miscellaneous,UPI,Give American something expect cold.,259.17,9.58
9/12/2024,Groceries,Credit Card,Activity American character.,53.4,0
9/8/2024,Transportation,NetBanking,Police attention movement wear.,168.02,0
5/2/2024,Subscriptions,UPI,Son expert mother lead sure section.,424.39,0
11/1/2024,Food,Cash,Tell woman from.,185.89,3.75
10/4/2024,Transportation,NetBanking,Win chair quality window.,143.96,6.68
5/16/2024,Groceries,Debit Card,Be dog bit let good quite.,404.88,10.28
3/16/2024,Transportation,Debit Card,Thought trip color as teach admit.,328.38,5.84
4/18/2024,Food,Credit Card,Never kind rule responsibility.,332.13,0
12/22/2024,Bills,Cash,Over team road hotel often official.,418.49,4.88
9/5/2024,Food,Debit Card,Everybody what best wonder significant sort.,425.73,2.46
10/24/2024,Food,NetBanking,Which season threat yeah attack draw.,308.76,0
9/19/2024,Food,UPI,Purpose much clearly fish great trip.,376.19,19.92
8/12/2024,Bills,UPI,Discover whether allow understand.,28.84,16.95
8/2/2024,Entertainment,Credit Card,Send know well quality consumer.,132.25,0
11/7/2024,Transportation,NetBanking,Despite appear water group note should.,478.69,0
7/2/2024,Miscellaneous,Debit Card,Happen half seek.,158.98,4.62
6/9/2024,Bills,Credit Card,Generation side they.,119.97,0
9/5/2024,Transportation,NetBanking,Try financial special.,414.77,0
2/6/2024,Transportation,NetBanking,Natural lay instead others both spring.,303.26,0
2/8/2024,Miscellaneous,Debit Card,Anything difference organization television.,103.87,4.54
4/18/2024,Bills,Credit Card,Modern if value will do eight.,422.25,0
7/21/2024,Bills,Credit Card,Represent somebody brother charge.,418.15,0
2/4/2024,Entertainment,Debit Card,Home its bring not.,333.4,0
8/21/2024,Transportation,Cash,Organization evidence own commercial.,72.41,0
8/15/2024,Subscriptions,Credit Card,Act maybe worker hit back produce.,188.08,0
9/19/2024,Miscellaneous,NetBanking,List public test look.,311.09,8.71
8/8/2024,Groceries,UPI,Crime necessary surface camera.,376.2,0
5/17/2024,Transportation,Credit Card,Cold so identify free.,336.5,10.08
8/14/2024,Transportation,Credit Card,Her fast large.,41.31,0
3/1/2024,Groceries,Debit Card,Food figure by.,249.32,11.69
9/17/2024,Groceries,Cash,Hard economy field attack I where.,131.23,0
7/1/2024,Bills,Debit Card,Listen assume letter something visit.,209.57,0
9/13/2024,Miscellaneous,Debit Card,Ever return general ask.,130.67,13.25
9/22/2024,Subscriptions,Debit Card,Mrs fine shoulder catch type certainly.,384.11,0
5/23/2024,Subscriptions,NetBanking,Wait our she such player almost.,330.02,13.03
5/15/2024,Miscellaneous,Credit Card,Bad to clear.,382.92,0
11/15/2024,Bills,UPI,Sing back care.,207.51,0
12/20/2024,Subscriptions,Debit Card,Entire child exist expect.,171.17,0
3/25/2024,Food,NetBanking,Establish whole ability beyond somebody.,314.01,10.55
12/21/2024,Groceries,UPI,People industry use impact.,99.59,0
11/7/2024,Entertainment,Cash,Young point statement produce movie school.,267.11,14.34
7/29/2024,Groceries,Credit Card,Inside old letter book agreement.,15.24,0
9/17/2024,Bills,Credit Card,Campaign perhaps TV.,85.07,15.49
7/30/2024,Transportation,Credit Card,Old person never.,234.8,6.43
12/17/2024,Entertainment,Credit Card,Full interest claim with.,259.42,15.36
7/19/2024,Subscriptions,UPI,Continue focus response reach degree.,377.8,0
5/12/2024,Bills,NetBanking,Third husband office television beautiful.,183.32,0
6/29/2024,Transportation,Debit Card,Nice director response last.,58.72,15.34
10/10/2024,Miscellaneous,Cash,Occur town leg reduce way main.,54.53,19.26
6/27/2024,Transportation,NetBanking,Eye population kid certain run.,92.93,4.34
3/23/2024,Miscellaneous,NetBanking,High low reach for whom.,187.59,0
10/20/2024,Food,Credit Card,Less food base including democratic.,53.33,10.2
4/2/2024,Miscellaneous,UPI,Rise serve most.,475.97,1.09
1/13/2024,Miscellaneous,Cash,Get might art increase civil across.,477.12,0
11/12/2024,Miscellaneous,Credit Card,Less enjoy interview these foot.,281.61,0
9/22/2024,Transportation,Credit Card,Television relate forget score population analysis.,151.67,0
7/1/2024,Food,UPI,Say worry develop million.,283.27,0
2/17/2024,Entertainment,Cash,Trial hear line project long.,339.69,3.69
5/24/2024,Entertainment,UPI,Everyone ever experience.,297.53,9.14
9/17/2024,Bills,UPI,Focus attention drop scientist fish.,191.15,19.92
9/9/2024,Groceries,NetBanking,Attorney try exactly make wear truth.,132.91,6.75
12/11/2024,Transportation,UPI,Attorney who prevent with.,270.7,10.31
3/23/2024,Bills,NetBanking,Decision wait she performance hear.,418.84,0
3/23/2024,Food,Cash,Eight both movie each feel road.,468.62,10.22
3/6/2024,Food,Cash,Be some adult poor house phone.,280.66,0
1/7/2024,Transportation,Credit Card,Tax imagine key cold future.,485.18,6.14
10/31/2024,Entertainment,Cash,Per rock like.,448.15,0
11/8/2024,Entertainment,NetBanking,Speak off per or rich.,280.7,0
4/28/2024,Bills,NetBanking,Make resource sign hear.,342.95,0
7/23/2024,Subscriptions,Debit Card,Network assume around environment human surface.,337.83,0
5/18/2024,Food,UPI,Should defense outside building usually.,498.36,10.83
12/1/2024,Groceries,NetBanking,Play resource one finally president look.,68,0
4/25/2024,Entertainment,Cash,Third life nothing seven Mrs firm.,93.64,0
10/5/2024,Entertainment,NetBanking,New training choice condition article fine.,102.8,0
7/7/2024,Subscriptions,NetBanking,Listen strong say cell serve win.,202.25,1.63
1/29/2024,Miscellaneous,UPI,Heart small financial learn fly.,303.83,10.9
4/16/2024,Groceries,Cash,Story best fish identify yet.,72.6,0
6/20/2024,Entertainment,Credit Card,Range decision remain world.,475.52,15.35
8/13/2024,Bills,Cash,Allow hope month.,452.75,0
8/5/2024,Subscriptions,Credit Card,Car minute see.,357.32,16.49
3/3/2024,Entertainment,Credit Card,Town read bad.,42.87,2.72
10/9/2024,Subscriptions,NetBanking,Hear court amount.,137.88,17.55
12/5/2024,Miscellaneous,Credit Card,Down talk alone understand sort ball.,72.47,0
5/17/2024,Groceries,Cash,Reach safe series detail free meeting.,494.31,3.41
3/25/2024,Transportation,UPI,Yeah attorney thank tax less have.,143.57,17.62
2/26/2024,Miscellaneous,UPI,And trouble example ready.,308.43,0
12/21/2024,Transportation,Cash,Represent firm clearly recently future.,83.71,0
1/31/2024,Transportation,UPI,Art home many.,144.96,0
7/7/2024,Groceries,UPI,Take road measure kind bag.,306.28,18.51
1/28/2024,Food,Credit Card,Option son close speech.,446.18,8.96
8/28/2024,Transportation,UPI,Use should turn truth those improve.,374.58,3.35
11/6/2024,Transportation,Cash,He structure sort item.,127.5,0
2/4/2024,Food,Debit Card,Bed cover wonder stage responsibility around.,48.18,3.04
11/2/2024,Food,Credit Card,Dinner push peace.,440.94,13.14
8/19/2024,Bills,Credit Card,Rather computer public.,158.93,4.01
11/3/2024,Bills,Credit Card,Positive training drive.,371.21,13.47
4/22/2024,Bills,Credit Card,Activity radio bank throw.,447.43,0
2/29/2024,Entertainment,Debit Card,Within likely current environmental example.,445.33,2.2
8/15/2024,Subscriptions,Credit Card,Own provide direction check.,66.33,4.15
2/17/2024,Subscriptions,UPI,May between remain foot.,374.32,7.35
7/13/2024,Transportation,NetBanking,Road foot difficult director Republican exist.,256.2,14.41
6/11/2024,Food,Debit Card,Tree discover despite move.,222.54,0
4/30/2024,Bills,Credit Card,Away president either with.,169.77,4.11
11/6/2024,Subscriptions,UPI,Media series weight.,401.11,2.95
7/15/2024,Food,UPI,Professional world recognize or spend both interest.,164.81,13.07
7/24/2024,Bills,NetBanking,Fall kind southern.,456.5,0
